{"domain":"positioning","items":[{"id":"item_a968203e8f882a00a2413a7d9c090153","payload":{"as_of":"2026-08-04T00:00:00.000Z","instrument_id":"GOLD","position":{"unit":"contracts","value":"245678"},"raw_metadata":{"market_and_exchange_names":"GOLD - COMMODITY EXCHANGE, INC.","noncomm_positions_short_all":"198765","open_interest_all":"455123","publication_date":"2026-08-07T19:30:00.000Z","report_date":"2026-08-04T00:00:00.000Z"},"type":"positioning"},"provider_id":"cftc","source":{"id":"cftc-item_a968203e8f882a00a2413a7d9c090153","kind":"news","knowledge_available_at":"2026-08-07T19:30:00.000Z","name":"CFTC Commitments of Traders","published_at":"2026-08-07T19:30:00.000Z","tier":"Tier 1","url":"https://www.cftc.gov/MarketReports/CommitmentsofTraders/index.htm"}}],"run_id":"2026-08-10T17:00:00.000Z::90fbf10fcfdc19b3bb42e66ac6942de7","schema_version":2}