{"domain":"filing","items":[{"id":"item_29bf5782cdb68ecbd7f861b6bfc95007","payload":{"accession_number":"0001067983-26-000014","company":"0001067983","filed_at":"2026-08-08T00:00:00.000Z","form":"13F-HR","raw_metadata":{},"type":"filing"},"provider_id":"sec_edgar","source":{"id":"sec-item_29bf5782cdb68ecbd7f861b6bfc95007","kind":"news","knowledge_available_at":"2026-08-08T00:00:00.000Z","name":"SEC EDGAR","published_at":"2026-08-08T00:00:00.000Z","tier":"Tier 1","url":"https://www.sec.gov/Archives/edgar/data/0001067983/000106798326000014/brka-20260630.xml"}}],"run_id":"2026-08-10T17:00:00.000Z::90fbf10fcfdc19b3bb42e66ac6942de7","schema_version":2}