{"domain":"policy","items":[{"id":"item_be4473e3e703e4ec7659f916c81e23e2","payload":{"announced_at":"2026-09-16T00:00:00.000Z","raw_metadata":{},"title":"中国人民银行副行长宣昌能会见伦敦证券交易所集团富时罗素首席执行官菲奥娜...","type":"policy"},"provider_id":"pboc","semantic_context":{"entities":[{"name":"中国人民银行","role":"issuer","type":"organization"}],"event":{"category":"official_policy_announcement","occurred_at":"2026-09-16T00:00:00.000Z"},"extension":{"action":"official_policy_announcement","affected_scope":[],"effective_at":null,"policy_type":"official_policy","type":"policy"},"numeric_facts":[],"version":1},"source":{"id":"pboc-item_be4473e3e703e4ec7659f916c81e23e2","kind":"news","knowledge_available_at":"2026-09-16T00:00:00.000Z","name":"中国人民银行","published_at":"2026-09-16T00:00:00.000Z","tier":"Tier 1","url":"https://www.pbc.gov.cn/goutongjiaoliu/113456/113469/2026091611280492893/index.html"}},{"id":"item_8fc57d86b3c35792493ecc6cb6870923","payload":{"announced_at":"2026-09-16T18:00:00.000Z","raw_metadata":{},"title":"Federal Reserve Board and Federal Open Market Committee release economic projections from the September 15-16 FOMC meeting","type":"policy"},"provider_id":"federal_reserve","semantic_context":{"entities":[{"name":"Federal Reserve","role":"issuer","type":"organization"}],"event":{"category":"monetary_policy","occurred_at":"2026-09-16T18:00:00.000Z"},"extension":{"action":"monetary_policy_statement","affected_scope":[],"effective_at":null,"policy_type":"monetary_policy","type":"policy"},"numeric_facts":[],"version":1},"source":{"id":"federal_reserve-item_8fc57d86b3c35792493ecc6cb6870923","kind":"news","knowledge_available_at":"2026-09-16T18:00:00.000Z","name":"Federal Reserve","published_at":"2026-09-16T18:00:00.000Z","tier":"Tier 1","url":"https://www.federalreserve.gov/newsevents/pressreleases/monetary20260916b.htm"}},{"id":"item_e305a4f93cd724f4220b11216183047a","payload":{"announced_at":"2026-09-16T18:00:00.000Z","raw_metadata":{},"title":"Federal Reserve issues FOMC statement","type":"policy"},"provider_id":"federal_reserve","semantic_context":{"entities":[{"name":"Federal Reserve","role":"issuer","type":"organization"}],"event":{"category":"monetary_policy","occurred_at":"2026-09-16T18:00:00.000Z"},"extension":{"action":"monetary_policy_statement","affected_scope":[],"effective_at":null,"policy_type":"monetary_policy","type":"policy"},"numeric_facts":[],"version":1},"source":{"id":"federal_reserve-item_e305a4f93cd724f4220b11216183047a","kind":"news","knowledge_available_at":"2026-09-16T18:00:00.000Z","name":"Federal Reserve","published_at":"2026-09-16T18:00:00.000Z","tier":"Tier 1","url":"https://www.federalreserve.gov/newsevents/pressreleases/monetary20260916a.htm"}},{"id":"item_9358ff98175fd72ffa9e647744d44d2e","payload":{"announced_at":"2026-09-17T00:00:00.000Z","raw_metadata":{},"title":"中国人民银行副行长宣昌能会见贝宝全球执行副总裁艾伦","type":"policy"},"provider_id":"pboc","semantic_context":{"entities":[{"name":"中国人民银行","role":"issuer","type":"organization"}],"event":{"category":"official_policy_announcement","occurred_at":"2026-09-17T00:00:00.000Z"},"extension":{"action":"official_policy_announcement","affected_scope":[],"effective_at":null,"policy_type":"official_policy","type":"policy"},"numeric_facts":[],"version":1},"source":{"id":"pboc-item_9358ff98175fd72ffa9e647744d44d2e","kind":"news","knowledge_available_at":"2026-09-17T00:00:00.000Z","name":"中国人民银行","published_at":"2026-09-17T00:00:00.000Z","tier":"Tier 1","url":"https://www.pbc.gov.cn/goutongjiaoliu/113456/113469/2026091717202687422/index.html"}},{"id":"item_96386967d6dbd85c1f413d01cf3faa3c","payload":{"announced_at":"2026-09-18T00:00:00.000Z","raw_metadata":{},"title":"中老跨境数字支付互联互通正式启动","type":"policy"},"provider_id":"pboc","semantic_context":{"entities":[{"name":"中国人民银行","role":"issuer","type":"organization"}],"event":{"category":"official_policy_announcement","occurred_at":"2026-09-18T00:00:00.000Z"},"extension":{"action":"official_policy_announcement","affected_scope":[],"effective_at":null,"policy_type":"official_policy","type":"policy"},"numeric_facts":[],"version":1},"source":{"id":"pboc-item_96386967d6dbd85c1f413d01cf3faa3c","kind":"news","knowledge_available_at":"2026-09-18T00:00:00.000Z","name":"中国人民银行","published_at":"2026-09-18T00:00:00.000Z","tier":"Tier 1","url":"https://www.pbc.gov.cn/goutongjiaoliu/113456/113469/2026091815494839605/index.html"}},{"id":"item_13c51f4b94430cda9b7465c4d73f81a7","payload":{"announced_at":"2026-09-18T15:00:00.000Z","raw_metadata":{},"title":"Federal Reserve Board issues enforcement actions with former employee of Northstar Bank, former employee of American Express Travel Related Services Company, Inc., and former employee of Regions Bank","type":"policy"},"provider_id":"federal_reserve","semantic_context":{"entities":[{"name":"Federal Reserve","role":"issuer","type":"organization"}],"event":{"category":"official_policy_announcement","occurred_at":"2026-09-18T15:00:00.000Z"},"extension":{"action":"official_policy_announcement","affected_scope":[],"effective_at":null,"policy_type":"official_policy","type":"policy"},"numeric_facts":[],"version":1},"source":{"id":"federal_reserve-item_13c51f4b94430cda9b7465c4d73f81a7","kind":"news","knowledge_available_at":"2026-09-18T15:00:00.000Z","name":"Federal Reserve","published_at":"2026-09-18T15:00:00.000Z","tier":"Tier 1","url":"https://www.federalreserve.gov/newsevents/pressreleases/enforcement20260918a.htm"}},{"id":"item_a90eb8d0b5486ded344ceea150ef1632","payload":{"announced_at":"2026-09-18T15:00:00.000Z","raw_metadata":{},"title":"Federal Reserve Board announces termination of enforcement action with SNB Bancshares and Bank of Eufaula","type":"policy"},"provider_id":"federal_reserve","semantic_context":{"entities":[{"name":"Federal Reserve","role":"issuer","type":"organization"}],"event":{"category":"official_policy_announcement","occurred_at":"2026-09-18T15:00:00.000Z"},"extension":{"action":"official_policy_announcement","affected_scope":[],"effective_at":null,"policy_type":"official_policy","type":"policy"},"numeric_facts":[],"version":1},"source":{"id":"federal_reserve-item_a90eb8d0b5486ded344ceea150ef1632","kind":"news","knowledge_available_at":"2026-09-18T15:00:00.000Z","name":"Federal Reserve","published_at":"2026-09-18T15:00:00.000Z","tier":"Tier 1","url":"https://www.federalreserve.gov/newsevents/pressreleases/enforcement20260918b.htm"}}],"run_id":"2026-09-21T05:07:25.054Z::07878dc24799eca1e4133d811b332341","schema_version":2}