{"domain":"news","items":[{"id":"item_4654b8f9f7cdc3e620dd82fd65f0ab5c","payload":{"occurred_at":"2026-09-21T00:00:00.000Z","raw_metadata":{},"snippet":"","source_content":{"document_sha256":"89fa13188d4e65115a04410be3f6c789a607f26224f4c80d5d9342853f9bcbf3","extraction_method":"official_html_text_v1","format":"plain_text","text":"根据《深圳证券交易所深港通业务实施办法》的有关规定，港股通标的证券名单发生调整并自2026年09月21日起生效，相关调整信息如下：\n\n代码\n\n简称\n\n调整方向\n\n03223\n\n君正股份\n\n调入\n\n06727\n\n星环科技\n\n调入\n\n特此公告\n\n中国创盈市场服务有限公司\n\n2026年09月21日","truncated":false},"title":"关于深港通下的港股通标的证券名单调整的公告","type":"news"},"provider_id":"szse","semantic_context":{"entities":[{"name":"深圳证券交易所","role":"subject","type":"organization"}],"event":{"category":"official_exchange_notice","occurred_at":"2026-09-21T00:00:00.000Z"},"extension":{"document":{"title":"关于深港通下的港股通标的证券名单调整的公告","type":"exchange_notice"},"type":"news"},"numeric_facts":[],"version":1},"source":{"id":"szse-item_4654b8f9f7cdc3e620dd82fd65f0ab5c","kind":"news","knowledge_available_at":"2026-09-21T00:00:00.000Z","name":"深圳证券交易所","published_at":"2026-09-21T00:00:00.000Z","tier":"Tier 1","url":"https://www.szse.cn/disclosure/notice/general/t20260921_622950.html"}}],"run_id":"2026-09-21T05:07:25.054Z::07878dc24799eca1e4133d811b332341","schema_version":2}